feed,title,long_url,short_url
BBC UK,Abbott criticises Speaker for race row debate snub,https://www.bbc.co.uk/news/uk-politics-68556911,https://da.gd/W9WMM
BBC UK,Israeli forces shoot dead 12-year-old who set off firework,https://www.bbc.co.uk/news/world-middle-east-68557147,https://da.gd/Dgpmt
BBC UK,Haiti violence: 'We're living with death on a daily basis',https://www.bbc.co.uk/news/world-latin-america-68555689,https://da.gd/TqYhYY
BBC UK,Olympics culture row as far right rages at French singer,https://www.bbc.co.uk/news/world-europe-68552093,https://da.gd/tucMD
BBC UK,Trump's Georgia judge dismisses some criminal charges,https://www.bbc.co.uk/news/world-us-canada-68557486,https://da.gd/m2AEpX
BBC UK,Murder-accused mum 'too ashamed to seek help',https://www.bbc.co.uk/news/uk-england-wear-68553891,https://da.gd/oL57XW
