feed,title,long_url,short_url
BBC UK,Foreign secretary James Cleverly to attend World Cup final,https://www.bbc.co.uk/news/uk-politics-66547111?at_medium=RSS&at_campaign=KARANGA,https://da.gd/EMxG9
BBC UK,Hurricane Hilary: Category 4 hurricane approaches California,https://www.bbc.co.uk/news/world-us-canada-66499946?at_medium=RSS&at_campaign=KARANGA,https://da.gd/tJTh9
BBC UK,Recreating the face of Bonnie Prince Charlie,https://www.bbc.co.uk/news/uk-scotland-66547219?at_medium=RSS&at_campaign=KARANGA,https://da.gd/RedU
BBC UK,Blind man says Easyjet staff 'refused to help' him buy flights,https://www.bbc.co.uk/news/uk-england-merseyside-66541768?at_medium=RSS&at_campaign=KARANGA,https://da.gd/kqvm
BBC UK,"Cologne Catholic diocese clergy and staff used work computers for porn, German media reports",https://www.bbc.co.uk/news/world-europe-66543503?at_medium=RSS&at_campaign=KARANGA,https://da.gd/ypLbMp
BBC UK,"RSPCA says more than 1,000 dogs reported with illegal ear cropping",https://www.bbc.co.uk/news/uk-england-66544012?at_medium=RSS&at_campaign=KARANGA,https://da.gd/32hx
