feed,title,long_url,short_url
NPR,4 takeaways from the historic ousting of House Speaker Kevin McCarthy,https://www.npr.org/2023/10/04/1203462629/kevin-mccarthy-speaker-matt-gaetz-congress-vote,https://da.gd/3rDID9
NPR,"All in: Drugmakers say yes, they'll negotiate with Medicare on price, so reluctantly",https://www.npr.org/sections/health-shots/2023/10/04/1203417818/medicare-drug-price-negotiations-begin,https://da.gd/LQQCH
NPR,Elon Musk is being sued for libel for accusing a man of having neo-Nazi links,https://www.npr.org/2023/10/04/1203339945/elon-musk-neo-nazi-defamation-lawsuit-ben-brody,https://da.gd/JRoh4q
NPR,Vatican gathering tackles topics from women in ministry to LGBTQ+ Catholics,https://www.npr.org/2023/10/04/1203312772/vatican-synod-gathering-tackles-women-in-ministry-lgbtq-catholics,https://da.gd/8bkL8E
NPR,The speed of fame almost made Dan + Shay split up. This is how they made it through,https://www.npr.org/2023/10/04/1203307530/dan-and-shay-new-album-bigger-houses-tour-bieber,https://da.gd/Uqer
NPR,Patrick Stewart says his time on 'Star Trek' felt like a ministry,https://www.npr.org/2023/10/04/1203298903/patrick-stewart-star-trek-ministry-picard,https://da.gd/6h37t
NPR,Why this fight is so personal for the UAW workers on strike,https://www.npr.org/2023/10/04/1202625396/uaw-strike-big-three-ford-unions,https://da.gd/8410
NPR,"New women's pro volleyball league just doubled its funding, thanks to famous investors",https://www.npr.org/2023/10/04/1203261702/women-s-pro-volleyball-league-doubles-its-funding-thanks-to-big-name-investors,https://da.gd/8qOl6
NPR,Student loans for parents can be a debt trap. But there's a loophole,https://www.npr.org/2023/10/04/1200775288/student-loans-parent-plus-save-plan,https://da.gd/x4e8m
