feed,title,long_url,short_url
BBC UK,Royal Mail: Three days left to use non-barcoded stamps,https://www.bbc.co.uk/news/business-66335213?at_medium=RSS&at_campaign=KARANGA,https://da.gd/WQYq7
BBC UK,Watch: Russia’s invasion of Ukraine through music by BBC Russia editor,https://www.bbc.co.uk/news/world-europe-66334494?at_medium=RSS&at_campaign=KARANGA,https://da.gd/A3TQK
BBC UK,Stack Rock Fort: Victorian island reclaimed by nature,https://www.bbc.co.uk/news/uk-wales-66256941?at_medium=RSS&at_campaign=KARANGA,https://da.gd/44um5
BBC UK,Russia's new tactic for cutting off Ukraine's grain,https://www.bbc.co.uk/news/world-europe-66328810?at_medium=RSS&at_campaign=KARANGA,https://da.gd/kvCX1
BBC UK,Should the Rosebank oilfield get the go ahead?,https://www.bbc.co.uk/news/uk-scotland-66325877?at_medium=RSS&at_campaign=KARANGA,https://da.gd/SAlfF2
