feed,title,long_url,short_url
BBC UK,Olympic diver using OnlyFans 'to make ends meet',https://www.bbc.com/news/articles/crg5g8jjr36o,https://da.gd/7F6Z5F
BBC UK,Agencies told to improve after Zara Aleena murder,https://www.bbc.com/news/articles/cydvdj2zmmpo,https://da.gd/lO5IA
BBC UK,"Whisper it, but is now a good time to holiday in Paris?",https://www.bbc.com/news/articles/cy7970gz3qro,https://da.gd/wm0F7
BBC UK,Fulham sign Smith Rowe from Arsenal for club record fee,https://www.bbc.com/sport/football/articles/cw0yvj275dvo,https://da.gd/iTmSwH
BBC UK,Alcaraz thrashes Auger-Aliassime to reach Olympic final,https://www.bbc.com/sport/olympics/articles/c7282nzl0ljo,https://da.gd/RomYBW
