feed,title,long_url,short_url
NPR,Weighing California's Political Influence After McCarthy's Resignation,https://www.npr.org/2023/12/10/1218466124/weighing-californias-political-influence-after-mccarthys-resignation,https://da.gd/ZBMB
NPR,Shohei Ohtani has a new deal with the LA Dodgers,https://www.npr.org/2023/12/10/1218466117/shohei-ohtani-has-a-new-deal-with-the-la-dodgers,https://da.gd/NrsYQ
NPR,Why protests at UN climate talks in UAE are not easy to find,https://www.npr.org/2023/12/10/1218246636/why-protests-at-un-climate-talks-in-uae-are-not-easy-to-find,https://da.gd/GhWR
NPR,COP28 Update: Promises And Regrets,https://www.npr.org/2023/12/10/1218466110/cop28-update-promises-and-regrets,https://da.gd/NKnx
NPR,"If Donald Trump becomes president again, how authoritarian would his agenda be?",https://www.npr.org/2023/12/10/1218466103/if-donald-trump-becomes-president-again-how-authoritarian-would-his-agenda-be,https://da.gd/JsyNVp
