feed,title,long_url,short_url
BBC UK,AI-generated naked child images shock Spanish town of Almendralejo,https://www.bbc.co.uk/news/world-europe-66877718?at_medium=RSS&at_campaign=KARANGA,https://da.gd/Tjy95
BBC UK,Tom Hanks predicts first baby born on the moon,https://www.bbc.co.uk/news/entertainment-arts-66890301?at_medium=RSS&at_campaign=KARANGA,https://da.gd/2uYTC
BBC UK,Art: 10-year mission to paint everyone in St Davids,https://www.bbc.co.uk/news/uk-wales-66787673?at_medium=RSS&at_campaign=KARANGA,https://da.gd/q6ReQC
BBC UK,Pablo Neruda: Chilean poet's death still shrouded in mystery,https://www.bbc.co.uk/news/world-latin-america-66853120?at_medium=RSS&at_campaign=KARANGA,https://da.gd/FxH063
BBC UK,Trudeau facing cold reality after lonely week on world stage,https://www.bbc.co.uk/news/in-pictures-66885924?at_medium=RSS&at_campaign=KARANGA,https://da.gd/ZULA
BBC UK,Charlie Gladstone: Rishi Sunak is completely wrong on slavery,https://www.bbc.co.uk/news/uk-politics-66882718?at_medium=RSS&at_campaign=KARANGA,https://da.gd/6OZsRy
