feed,title,long_url,short_url
BBC UK,Water voles brought back to the Lake District,https://www.bbc.co.uk/news/science-environment-66525526?at_medium=RSS&at_campaign=KARANGA,https://da.gd/h7p4cf
BBC UK,"Government failing disabled people, human rights watchdog warns",https://www.bbc.co.uk/news/uk-politics-66529440?at_medium=RSS&at_campaign=KARANGA,https://da.gd/Cda0
BBC UK,Scottish film-makers to bring horror studio back from the grave,https://www.bbc.co.uk/news/uk-scotland-66509736?at_medium=RSS&at_campaign=KARANGA,https://da.gd/Ofl3u1
BBC UK,The baby at the centre of an India-Germany diplomatic row,https://www.bbc.co.uk/news/world-asia-india-66477396?at_medium=RSS&at_campaign=KARANGA,https://da.gd/c7pOu
BBC UK,A-levels: How does clearing work and what are the options?,https://www.bbc.co.uk/news/uk-wales-66522543?at_medium=RSS&at_campaign=KARANGA,https://da.gd/ZPi5x
