feed,title,long_url,short_url
NPR,"AI brings soaring emissions for Google and Microsoft, a major contributor to climate change",https://www.npr.org/2024/07/12/g-s1-9545/ai-brings-soaring-emissions-for-google-and-microsoft-a-major-contributor-to-climate-change,https://da.gd/t1SWr
NPR,Sexual assault cases involving U.S. military personnel strain relations with Japan,https://www.npr.org/2024/07/12/nx-s1-5035032/sexual-assault-cases-involving-u-s-military-personnel-strain-relations-with-japan,https://da.gd/0WBE1G
NPR,A former inmate finds meaning through his work as a death doula,https://www.npr.org/2024/07/12/nx-s1-5034979/a-former-inmate-finds-meaning-through-his-work-as-a-death-doula,https://da.gd/exRMy
NPR,Social media is fueling a tween skin care craze. Some dermatologists are wary,https://www.npr.org/sections/shots-health-news/2024/07/12/nx-s1-4990677/teens-skin-care-social-media-tweens-tiktok-influencers,https://da.gd/hX7TaO
NPR,Hiking during extreme heat can be deadly. Here's why and how to stay safe,https://www.npr.org/2024/07/11/nx-s1-5035209/extreme-heat-hiking-safety,https://da.gd/3bsfA
NPR,What celebrity loves Biden — but wants him to drop out? Find out in the quiz,https://www.npr.org/2024/07/11/g-s1-9471/clooney-biden-trump-project-2025-paramount-skydance,https://da.gd/iOouMf
NPR,"How to live without plastics for a month, according to the founder of a global movement",https://www.npr.org/2024/07/12/nx-s1-5021545/plastic-free-july-sustainability-tips,https://da.gd/XoBkL
NPR,"After Biden's debate performance, the presidential race is unchanged",https://www.npr.org/2024/07/12/nx-s1-5036518/biden-trump-poll,https://da.gd/grf6t0
