feed,title,long_url,short_url
NPR,Underground tours resume at Minnesota's oldest iron mine,https://www.npr.org/2024/06/25/nx-s1-4985684/underground-tours-resume-at-minnesotas-oldest-iron-mine,https://da.gd/prg2Xh
NPR,Utah gubernatorial primary: Gov. Cox accused of not being conservative enough,https://www.npr.org/2024/06/25/nx-s1-5013900/utah-gubernatorial-primary-gov-cox-accused-of-not-being-conservative-enough,https://da.gd/ZyRsS6
NPR,A Missouri rehab program struggles amid a spike of child fentanyl deaths,https://www.npr.org/2024/06/25/nx-s1-5013728/a-missouri-rehab-program-struggles-amid-a-spike-of-child-fentanyl-deaths,https://da.gd/Jl1nOi
NPR,The question whether women should be required to register for the draft resurfaces,https://www.npr.org/2024/06/25/nx-s1-5017714/the-question-whether-women-should-be-required-to-register-for-the-draft-resurfaces,https://da.gd/s6L1Qm
NPR,What one religion in South Korea is doing to attract new followers,https://www.npr.org/2024/06/25/nx-s1-5018083/what-one-religion-in-south-korea-is-doing-to-attract-new-followers,https://da.gd/4V0wMQ
