feed,title,long_url,short_url
BBC UK,Coco Lee: The pioneering singer who charmed the world,https://www.bbc.co.uk/news/world-asia-66117306?at_medium=RSS&at_campaign=KARANGA,https://da.gd/8gTl
BBC UK,Cardiff: Hundreds due at e-bike crash boys' Ely funeral,https://www.bbc.co.uk/news/uk-wales-66118703?at_medium=RSS&at_campaign=KARANGA,https://da.gd/quap
BBC UK,The Ashes: England's Stuart Broad dismisses Australia's David Warner in first over,https://www.bbc.co.uk/sport/av/cricket/66120894?at_medium=RSS&at_campaign=KARANGA,https://da.gd/ikUr
BBC UK,Hannah Dingley: Female football boss hopes to inspire young girls to break through glass ceilings,https://www.bbc.co.uk/sport/football/66115949?at_medium=RSS&at_campaign=KARANGA,https://da.gd/1G7rX
BBC UK,Rent increases: What you can do about a rise from your landlord,https://www.bbc.co.uk/news/business-63290805?at_medium=RSS&at_campaign=KARANGA,https://da.gd/e16js
BBC UK,Why food bills aren't shrinking?,https://www.bbc.co.uk/news/business-65632019?at_medium=RSS&at_campaign=KARANGA,https://da.gd/GJYO0
BBC UK,Mortgage rates: Five ways to save money,https://www.bbc.co.uk/news/business-65984415?at_medium=RSS&at_campaign=KARANGA,https://da.gd/Cbull
