feed,title,long_url,short_url
NPR,"Gale-force winds and floods strike northern Europe, killing at least 3 in the U.K",https://www.npr.org/2023/10/21/1207752390/gale-force-winds-floods-strike-northern-europe,https://da.gd/bfDRa
Al Jazeera,Sierra Leone’s president: Are there good military coups?,https://www.aljazeera.com/program/talk-to-al-jazeera/2023/10/21/sierra-leones-president-are-there-good-military-coups?traffic_source=rss,https://da.gd/rGVNur
New York Times World,Israel-Hamas War: U.S. Officials Fear Israeli Strike on Hezbollah Could Widen War,https://www.nytimes.com/live/2023/10/21/world/israel-hamas-war-gaza-news,https://da.gd/sicuX
Al Jazeera,Thousands join pro-Palestinian rallies in Australia amid Gaza bombardment,https://www.aljazeera.com/news/2023/10/21/thousands-join-pro-palestinian-rallies-in-australia-amid-gaza-bombardment?traffic_source=rss,https://da.gd/Xlix5
Al Jazeera,"Rafah border crossing between Gaza, Egypt opens for aid trucks",https://www.aljazeera.com/news/2023/10/21/rafah-border-crossing-between-gaza-egypt-opens-for-aid-trucks?traffic_source=rss,https://da.gd/bCcm26
