feed,title,long_url,short_url
BBC UK,Baldwin announces reality show while awaiting trial,https://www.bbc.com/news/articles/c4nn5zze5m0o,https://da.gd/d5kw
BBC UK,Watch: Ex-Post Office chair Alice Perkins giving evidence at inquiry,https://www.bbc.co.uk/news/live/uk-69091679,https://da.gd/b6bRS
BBC UK,Peaky Blinders film starring Cillian Murphy confirmed,https://www.bbc.com/news/articles/crggj21q8q1o,https://da.gd/rl5k5
BBC UK,'I was in a coma and my DNA was taken without consent',https://www.bbc.com/news/articles/c722l2d677no,https://da.gd/aWUj5
BBC UK,Kanye West accuses former assistant of blackmail,https://www.bbc.com/news/articles/cy00r5vg4gvo,https://da.gd/DphxIp
BBC UK,Released murderer's second killing 'horrific',https://www.bbc.com/news/articles/cw4433dpj48o,https://da.gd/dtEr7
