feed,title,long_url,short_url
NPR,Concrete structures meant to protect Baltimore bridge appear unchanged for decades,https://npr.org/2024/04/04/1242605876/baltimore-bridge-collapse-dolphins,https://da.gd/K1T1
NPR,California colleges provide abortion pills but many fail to make students aware,https://npr.org/sections/health-shots/2024/04/04/1242597516/california-campus-abortion-pills-access,https://da.gd/hj8K0
NPR,Taiwan emerges remarkably unscathed after massive earthquake,https://npr.org/2024/04/04/1242721841/taiwan-emerges-remarkably-unscathed-after-massive-earthquake,https://da.gd/O47vf
NPR,What to know about the risks of the bird flu outbreak,https://npr.org/sections/health-shots/2024/04/04/1242711884/bird-flu-h5n1-cattle-eggs-humans-vaccine,https://da.gd/Jo2vPa
NPR,"These twin brothers are identical, but their autism isn't",https://npr.org/sections/health-shots/2024/04/04/1242264274/siblings-science-identical-twin-brothers-autism-spectrum,https://da.gd/SDUnR3
