feed,title,long_url,short_url
BBC UK,Christmas: 21 million cars expected for festive getaway,https://www.bbc.co.uk/news/uk-wales-67691953?at_medium=RSS&at_campaign=KARANGA,https://da.gd/pbth
BBC UK,Brain surgery teen to have first seizure-free Christmas,https://www.bbc.co.uk/news/uk-scotland-edinburgh-east-fife-67762097?at_medium=RSS&at_campaign=KARANGA,https://da.gd/tpDIIF
BBC UK,In pictures: The many lives of India's Dalits,https://www.bbc.co.uk/news/world-asia-india-67700608?at_medium=RSS&at_campaign=KARANGA,https://da.gd/1tGzpS
BBC UK,It's a Wonderful Life: How a festive classic helps a Glasgow cinema thrive,https://www.bbc.co.uk/news/uk-scotland-glasgow-west-67764480?at_medium=RSS&at_campaign=KARANGA,https://da.gd/AUnhvj
BBC UK,How important are the Iowa caucuses in the 2024 election?,https://www.bbc.co.uk/news/world-us-canada-67752715?at_medium=RSS&at_campaign=KARANGA,https://da.gd/ex6A4L
