feed,title,long_url,short_url
BBC UK,Arrest after man sexually assaulted on train to Cardiff,https://www.bbc.co.uk/news/uk-wales-66294849?at_medium=RSS&at_campaign=KARANGA,https://da.gd/0ktgOW
BBC UK,How desperate US prisoners try to escape deadly heat,https://www.bbc.co.uk/news/world-us-canada-66274629?at_medium=RSS&at_campaign=KARANGA,https://da.gd/Agsrwd
BBC UK,Twitter logo designer speaks out on changes,https://www.bbc.co.uk/news/world-us-canada-66297493?at_medium=RSS&at_campaign=KARANGA,https://da.gd/8QcF
BBC UK,Ghana minister Cecilia Abena Dapaah reported a robbery. Why was she arrested?,https://www.bbc.co.uk/news/world-africa-66291294?at_medium=RSS&at_campaign=KARANGA,https://da.gd/6mGMoR
BBC UK,Obamas' chef Tafari Campbell dies in paddleboarding accident,https://www.bbc.co.uk/news/world-us-canada-66297450?at_medium=RSS&at_campaign=KARANGA,https://da.gd/WRNsb
