feed,title,long_url,short_url
NPR,"As Ramadan begins, uncertainty and anxiety surround the Al-Aqsa mosque",https://npr.org/2024/03/11/1237399456/ramadan-anxiety-al-aqsa-mosque,https://da.gd/2otVv
NPR,Muslims prepare for a more somber Ramadan due to the Israel-Hamas war,https://npr.org/2024/03/10/1236630201/muslims-prepare-for-a-more-somber-ramadan-due-to-the-israel-hamas-war,https://da.gd/gKk44
NPR,Harris plans to visit the Parkland school where 14 kids were killed in 2018,https://npr.org/2024/03/11/1237215884/harris-will-visit-parkland-school,https://da.gd/fOZ5rN
NPR,Young voters helped elect Biden in 2020. His campaign is courting them again in 2024,https://npr.org/2024/03/11/1237158627/biden-campaign-students-young-voters-gen-z-millennials,https://da.gd/mIl3oi
NPR,Women who do strength training live longer. How much is enough?,https://npr.org/sections/health-shots/2024/03/11/1236791784/strength-resistance-weight-training-longevity-aging-heart-disease,https://da.gd/ostE
NPR,"The new kids on campus? Toddlers, courtesy of Head Start",https://npr.org/2024/03/11/1236619407/community-college-student-child-care-head-start,https://da.gd/D5HGKh
