feed,title,long_url,short_url
NPR,"Rat plague hits an Australian coastal town, and thousands more wash up on shore",https://www.npr.org/2023/11/27/1215027704/rat-plague-australian-coastal-town,https://da.gd/YdyTv
NPR,Civilian deaths are being dismissed as 'crisis actors' in Gaza and Israel,https://www.npr.org/2023/11/27/1214451419/civilian-deaths-are-being-dismissed-as-crisis-actors-in-gaza-and-israel,https://da.gd/zFSOAD
NPR,"To save axolotls, a campaign in Mexico asks people to virtually adopt them",https://www.npr.org/2023/11/27/1215247480/save-axolotls-mexico-endangered-virtual-adoption,https://da.gd/EFP95
NPR,"'Today, your son is my son': A doctor's words offer comfort before surgery",https://www.npr.org/2023/11/27/1214534881/today-your-son-is-my-son-a-doctors-words-offer-comfort-before-surgery,https://da.gd/T79JD
NPR,Biden uses Charlottesville to talk about political violence. But he hasn't been there,https://www.npr.org/2023/11/27/1214460025/biden-uses-charlottesville-to-talk-about-political-violence-but-he-hasnt-been-th,https://da.gd/5ILYW
NPR,FAQ: Annual climate negotiations are about to start. Do they matter?,https://www.npr.org/2023/11/27/1209676382/cop28-climate-change-conference-faq,https://da.gd/tjB273
NPR,Google is deleting unused accounts this week. Here's how to save your old data,https://www.npr.org/2023/11/27/1215285876/google-inactive-account-delete-policy,https://da.gd/ePyQ
NPR,"Millions of U.S. apples were almost left to rot. Now, they'll go to hungry families",https://www.npr.org/2023/11/27/1214197904/millions-of-u-s-apples-were-almost-left-to-rot-now-theyll-go-to-hungry-families,https://da.gd/Bgm4N2
