feed,title,long_url,short_url
NPR,Progressives try to send a message of resistance through the RNC security barrier,https://www.npr.org/2024/07/16/nx-s1-5040899/rnc-progressive-protesters-milwaukee-trump-presidential-election,https://da.gd/iWFg6U
NPR,"Federal dollars speed up work on safe streets, but money isn’t the only roadblock",https://www.npr.org/2024/07/16/nx-s1-4994312/road-safety-federal-infrastructure-spending-safe-streets,https://da.gd/njbxq
NPR,Wisconsin Republicans have a plan for engaging new voters,https://www.npr.org/2024/07/15/nx-s1-4998536/wisconsin-republicans-have-a-plan-for-engaging-new-voters,https://da.gd/335QU
NPR,California’s wildfires are burning far more land so far this year than in 2023,https://www.npr.org/2024/07/16/nx-s1-5041344/california-wildfires-acres-calfire,https://da.gd/cebj8I
NPR,"The best games of 2024 so far, picked by the NPR staff",https://www.npr.org/2024/07/16/g-s1-9554/the-best-games-of-2024-so-far-picked-by-the-npr-staff,https://da.gd/Yv8Ch
NPR,"Her hearing implant was preapproved. But she still received multiple $139,000 bills",https://www.npr.org/sections/shots-health-news/2024/07/16/nx-s1-5036595/hearing-implant-preapproved-still-got-multiple-139000-bills,https://da.gd/9SN8IE
