feed,title,long_url,short_url
BBC World,Biden pardons veterans convicted under military ban on gay sex,https://www.bbc.com/news/articles/cjeerggvqw1o,https://da.gd/PcF7G
BBC World,Music festival blamed for gazelle deaths in Spain,https://www.bbc.com/news/articles/cjmm9ge38r2o,https://da.gd/ZyQZl
BBC World,Timbuktu's jihadist police chief guilty of war crimes,https://www.bbc.com/news/articles/c2ee4208mlzo,https://da.gd/QBT5h
BBC World,One killed after Colombia cable car falls from station,https://www.bbc.com/news/articles/cn338m5l98jo,https://da.gd/xfw1mS
BBC World,Sleepy Saipan witnesses end of Julian Assange legal saga,https://www.bbc.com/news/articles/cxww278gr0zo,https://da.gd/CoMVE
