feed,title,long_url,short_url
NPR,George Latimer defeated Democratic Congressman Jamaal Bowman in New York's primary,https://www.npr.org/2024/06/26/nx-s1-5015373/george-latimer-defeated-democratic-congressman-jamaal-bowman-in-new-yorks-primary,https://da.gd/tnTCK
NPR,Kenya's president has withdrawn the controversial tax bill after deadly protests,https://www.npr.org/2024/06/26/nx-s1-5020297/kenya-president-withdraws-tax-bill-deadly-protests,https://da.gd/Gc6Z
NPR,What Biden and Trump do could matter as much as what they say in tomorrow's debate,https://www.npr.org/2024/06/26/nx-s1-5005303/what-biden-and-trump-do-could-matter-as-much-as-what-they-say-in-tomorrows-debate,https://da.gd/SXbxb
NPR,Congress poured billions of dollars into schools. Did it help students learn?,https://www.npr.org/2024/06/18/nx-s1-5010963/schools-aid-students-pandemic,https://da.gd/PIfX2m
NPR,Surgeon who saved Sen. Duckworth says he couldn't save her with those wounds in Gaza,https://www.npr.org/2024/06/26/nx-s1-5020185/surgeon-who-saved-sen-duckworth-says-he-couldnt-save-her-with-those-wounds-in-gaza,https://da.gd/ExzyG
NPR,Looting in Gaza has led to skyrocketing food prices,https://www.npr.org/2024/06/26/nx-s1-5020127/looting-in-gaza-has-led-to-skyrocketing-food-prices,https://da.gd/9uGs7b
