feed,title,long_url,short_url
NPR,Churches confess and repent for sins against Native and Indigenous people,https://www.npr.org/2023/10/06/1203760200/churches-confess-and-repent-for-sins-against-native-and-indigenous-people,https://da.gd/d0Ydsi
NPR,The bruising artillery battle in Ukraine has left a scar that is visible from space,https://www.npr.org/2023/10/06/1203372829/the-bruising-artillery-battle-in-ukraine-has-left-a-scar-that-is-visible-from-sp,https://da.gd/2LXu
NPR,What's plaguing Paris and why are Catholics gathering in Rome? Find out in the quiz,https://www.npr.org/2023/10/06/1203806074/npr-news-quiz-paris-vatican-rome-mccarthy-congress,https://da.gd/FpNEV
NPR,"Want flattering coverage in a top Florida politics site? It could be yours for $2,750",https://www.npr.org/2023/10/06/1203271345/florida-politics-peter-schorsch-southeast,https://da.gd/V2tGR9
NPR,The fate of Ukraine funding lies in the balance with speaker's race,https://www.npr.org/2023/10/06/1203961930/ukraine-funding-congress-speakers-race,https://da.gd/aEKj2j
NPR,Kentucky had an outside-the-box idea to fix child care worker shortages. It's working,https://www.npr.org/2023/10/06/1203182131/kentucky-free-child-care-day-care-workers,https://da.gd/CuDP7n
