feed,title,long_url,short_url
NPR,Should President Biden step aside in the 2024 election?,https://www.npr.org/2024/06/29/nx-s1-5023641/should-president-biden-step-aside-in-the-2024-election,https://da.gd/l2Ozp3
NPR,The Supreme Court overruled decades of administrative law. What happens now?,https://www.npr.org/2024/06/29/nx-s1-5022946/the-supreme-court-overruled-decades-of-administrative-law-what-happens-now,https://da.gd/qYcdLs
NPR,U.S. gymnastics Olympic trials take place in Minneapolis,https://www.npr.org/2024/06/29/nx-s1-5022885/u-s-gymnastics-olympic-trials-take-place-in-minneapolis,https://da.gd/ZjkJa
NPR,"Ahead of parliamentary elections, the French left unites against the right",https://www.npr.org/2024/06/29/nx-s1-5021778/ahead-of-parliamentary-elections-the-french-left-unites-against-the-right,https://da.gd/XQJ1Gd
NPR,'Road to Rickwood' tells the story of Alabama's famed Rickwood Field,https://www.npr.org/2024/06/29/nx-s1-5020515/road-to-rickwood-tells-the-story-of-alabamas-famed-rickwood-field,https://da.gd/bFq64
