feed,title,long_url,short_url
BBC UK,NI strike: Thousands of public sector workers stage 24-hour stoppage,https://www.bbc.co.uk/news/uk-northern-ireland-67981000?at_medium=RSS&at_campaign=KARANGA,https://da.gd/2OWY
BBC UK,Train ticket machines charging double online price,https://www.bbc.co.uk/news/business-68009768?at_medium=RSS&at_campaign=KARANGA,https://da.gd/arG1
BBC UK,Peregrine lander: US Moon mission on course for fiery destruction,https://www.bbc.co.uk/news/science-environment-67962397?at_medium=RSS&at_campaign=KARANGA,https://da.gd/KW9k6
BBC UK,Unseen images of code breaking computer that helped win WW2,https://www.bbc.co.uk/news/technology-67997406?at_medium=RSS&at_campaign=KARANGA,https://da.gd/rJOYYP
BBC UK,"Courtney Dauwalter: Step inside the 'pain cave', where rules are remade",https://www.bbc.co.uk/sport/athletics/67945344?at_medium=RSS&at_campaign=KARANGA,https://da.gd/HFB6w4
