feed,title,long_url,short_url
BBC UK,Gabon's predators on the pitch: Inside a paedophile football scandal,https://www.bbc.co.uk/news/world-africa-66959227?at_medium=RSS&at_campaign=KARANGA,https://da.gd/0D3KQ
BBC UK,Migrants trying to reach the UK cross the Alps on foot,https://www.bbc.co.uk/news/world-europe-66934839?at_medium=RSS&at_campaign=KARANGA,https://da.gd/QnPaC
BBC UK,The former footballer scoring with his art,https://www.bbc.co.uk/news/uk-scotland-glasgow-west-66846332?at_medium=RSS&at_campaign=KARANGA,https://da.gd/Il824W
BBC UK,The people going 'monk mode' to limit social media use,https://www.bbc.co.uk/news/business-66934688?at_medium=RSS&at_campaign=KARANGA,https://da.gd/HXPk53
BBC UK,Swifties join tailgate as new NFL beau Travis Kelce set to play,https://www.bbc.co.uk/news/world-us-canada-66967813?at_medium=RSS&at_campaign=KARANGA,https://da.gd/gcr1
BBC UK,"From Scotland to Canada, a totem pole finally returns home",https://www.bbc.co.uk/news/world-us-canada-66932129?at_medium=RSS&at_campaign=KARANGA,https://da.gd/7wggjV
