feed,title,long_url,short_url
NPR,"In Japan, a J-Pop star has come out as gay and his fans cheer",https://www.npr.org/2023/07/27/1190422361/in-japan-a-j-pop-star-has-come-out-as-gay-and-his-fans-cheer,https://da.gd/EHkNTW
NPR,Mattel tried to report financials. All anyone wanted to talk about was 'Barbie',https://www.npr.org/2023/07/27/1190378734/mattel-tried-to-report-financials-all-anyone-wanted-to-talk-about-was-barbie,https://da.gd/ukAf
NPR,Weighted infant sleepwear is meant to help babies rest better. Critics say it's risky,https://www.npr.org/2023/07/27/1190263995/weighted-infant-sleepwear-safety,https://da.gd/JeBy
NPR,"His doctors billed Medicare late. Then he got sent to collections for the $3,000 tab",https://www.npr.org/sections/health-shots/2023/07/27/1190055980/his-doctors-billed-medicare-late-then-he-got-sent-to-collections-for-the-3-000-t,https://da.gd/PK1n
NPR,A doctor leaves a lasting impression on a woman caring for her dying mom,https://www.npr.org/2023/07/27/1189801875/cancer-doctor-health-mom,https://da.gd/9XPCXS
