feed,title,long_url,short_url
Al Jazeera,Nigerien army pledges allegiance to coup plotters,https://www.aljazeera.com/news/2023/7/27/nigerien-army-pledges-allegiance-to-coup-plotters,https://da.gd/UZqo
Al Jazeera,Is Netanyahu good for the Palestinians?,https://www.aljazeera.com/opinions/2023/7/27/is-netanyahu-good-for-the-palestinians,https://da.gd/7Qsut
Al Jazeera,"Niger’s Bazoum: ‘Hard-won’ democratic gains will be protected, despite coup",https://www.aljazeera.com/news/2023/7/27/nigers-bazoum-hard-won-democratic-gains-will-be-protected-despite-coup,https://da.gd/1rasMC
Al Jazeera,Key takeaways from the US congressional hearing on UFOs,https://www.aljazeera.com/news/2023/7/27/key-takeaways-from-the-us-congressional-hearing-on-ufos,https://da.gd/aSXy
Al Jazeera,A battle for rights and recognition: India’s female fighters,https://www.aljazeera.com/program/101-east/2023/7/27/a-battle-for-rights-and-recognition-indias-female-fighters,https://da.gd/kNYdPq
