feed,title,long_url,short_url
NPR,The U.S. is unprepared for the growing threat of mosquito- and tick-borne viruses,https://www.npr.org/sections/health-shots/2023/12/15/1219478835/arboviruses-mosquito-tick-borne-viruses-tropical-disease,https://da.gd/GEJ9Pi
NPR,"How do you discipline an in-school overdose? In some districts, you don't",https://www.npr.org/2023/12/15/1219286465/how-do-you-discipline-an-in-school-overdose-in-some-districts-you-dont,https://da.gd/IgFl1h
NPR,The accounts of freed Israeli hostages add pressure to save those still in captivity,https://www.npr.org/2023/12/15/1219151214/israeli-hostages-hamas-gaza,https://da.gd/5OB44d
NPR,"From killer cats to Christmas classics, this week's quiz is both feral and festive",https://www.npr.org/2023/12/15/1218764773/christmas-movies-cats-biden-airline-birds-news-quiz,https://da.gd/E8OSN
NPR,"Weird, wild and wonderful stories of joy from 2023",https://www.npr.org/2023/12/15/1217628934/good-news-2023,https://da.gd/DRkIu
