feed,title,long_url,short_url
NPR,A look back at some of the top political stories of 2023,https://www.npr.org/2023/12/28/1219680122/year-in-politics-trump-biden-mccarthy-israel-ukraine,https://da.gd/lOChu
NPR,2023 will be the hottest year on record. Is this how it's going to be now?,https://www.npr.org/2023/12/28/1221827923/2023-hottest-year-record-climate-change,https://da.gd/8Ccof
NPR,What is hospice care? 6 myths about this end-of-life option,https://www.npr.org/2023/12/28/1221648271/hospice-care-myths-jimmy-carter-end-of-life,https://da.gd/pW6etA
NPR,Doctors are pushing Hollywood for more realistic depictions of death and dying on TV,https://www.npr.org/sections/health-shots/2023/12/28/1221645389/doctors-are-pushing-hollywood-for-more-realistic-depictions-of-death-and-dying-o,https://da.gd/3lqHne
NPR,Directors pick the soundtracks for NPR's shows. Here are their own 2023 playlists,https://www.npr.org/2023/12/28/1220612546/music-playlist-npr-all-things-consider-wrapped-2023,https://da.gd/ObJFrB
NPR,"The $7,500 tax credit for electric cars will see big changes in 2024. What to know",https://www.npr.org/2023/12/28/1219158071/ev-electric-vehicles-tax-credit-car-shopping-tesla-ford-vw-gm,https://da.gd/16HL
NPR,"Actors, musicians, writers and artists we lost in 2023",https://www.npr.org/2023/12/28/1217683485/died-in-2023,https://da.gd/684HCE
