feed,title,long_url,short_url
BBC UK,How to get a job: Six expert tips for finding work,https://www.bbc.co.uk/news/business-64939070?at_medium=RSS&at_campaign=KARANGA,https://da.gd/BriEN
BBC UK,Cost of living: Five tips when asking for a pay rise,https://www.bbc.co.uk/news/business-64288791?at_medium=RSS&at_campaign=KARANGA,https://da.gd/2RUz
BBC UK,What are my rights if my flight is cancelled?,https://www.bbc.co.uk/news/business-61646214?at_medium=RSS&at_campaign=KARANGA,https://da.gd/OOuD
BBC UK,UK inflation rate calculator: How much are prices rising for you?,https://www.bbc.co.uk/news/business-62558817?at_medium=RSS&at_campaign=KARANGA,https://da.gd/ethGdK
BBC UK,State pension: What is it worth and when do you get it?,https://www.bbc.co.uk/news/business-53082530?at_medium=RSS&at_campaign=KARANGA,https://da.gd/s6INhH
