feed,title,long_url,short_url
NPR,Top tech leaders are to meet with U.S. senators on the future of AI regulation,https://www.npr.org/2023/09/13/1198994746/top-tech-leaders-are-to-meet-with-u-s-senators-on-the-future-of-ai-regulation,https://da.gd/2cjEN
NPR,Why the transition to electric cars looms large in UAW talks with Big 3 automakers,https://www.npr.org/2023/09/13/1198904929/uaw-unions-automakers-big-3-gm-ford-stellantis-shawn-fain,https://da.gd/3YytNj
NPR,The new COVID boosters are coming: Here's what you need to know,https://www.npr.org/sections/health-shots/2023/09/13/1198803134/covid-boosters-updated-vaccines-fda-cdc,https://da.gd/0aR23B
NPR,4 reasons why your car insurance premium is soaring,https://www.npr.org/2023/09/13/1199032000/car-auto-insurance-premium-inflation,https://da.gd/MJmVWA
NPR,"After months on the market, 'The Brady Bunch' house sells for $3.2 million",https://www.npr.org/2023/09/13/1199008678/after-months-on-the-market-the-brady-bunch-house-sells-for-3-2-million,https://da.gd/zD1K
NPR,Biden loves to talk about unions. But the autoworkers are withholding their affection,https://www.npr.org/2023/09/13/1198764355/biden-united-auto-workers-uaw-union-strike-2024,https://da.gd/D1GnU3
