feed,title,long_url,short_url
BBC UK,Chancellor Jeremy Hunt hints at further tax cuts,https://www.bbc.co.uk/news/business-68027060?at_medium=RSS&at_campaign=KARANGA,https://da.gd/eD8QP5
BBC UK,Donald Trump says Colorado ballot ban could unleash 'chaos',https://www.bbc.co.uk/news/68026910?at_medium=RSS&at_campaign=KARANGA,https://da.gd/A7T8EC
BBC UK,Energy standing charges review prompts huge response,https://www.bbc.co.uk/news/business-68024339?at_medium=RSS&at_campaign=KARANGA,https://da.gd/aFz2
BBC UK,Melania Trump gives eulogy at mother's funeral,https://www.bbc.co.uk/news/world-us-canada-68026771?at_medium=RSS&at_campaign=KARANGA,https://da.gd/vgA1FX
BBC UK,Long Covid: NHS legal action launched by family of girl,https://www.bbc.co.uk/news/uk-scotland-north-east-orkney-shetland-68017038?at_medium=RSS&at_campaign=KARANGA,https://da.gd/cxw0s
BBC UK,The Papers: Netanyahu 'will not accept' Palestinian state and 'Nato warns of war',https://www.bbc.co.uk/news/blogs-the-papers-68026752?at_medium=RSS&at_campaign=KARANGA,https://da.gd/idffpc
BBC UK,Tata steel: What do plans mean for UK's carbon footprint,https://www.bbc.co.uk/news/uk-wales-68017180?at_medium=RSS&at_campaign=KARANGA,https://da.gd/6EZIjB
BBC UK,Cash-in-transit heists bring terror to South Africa’s roads,https://www.bbc.co.uk/news/world-africa-68023079?at_medium=RSS&at_campaign=KARANGA,https://da.gd/qWyK3
BBC UK,Diego Garcia: UN says UK military island not suitable for stranded migrants,https://www.bbc.co.uk/news/uk-67996408?at_medium=RSS&at_campaign=KARANGA,https://da.gd/2r92wM
