feed,title,long_url,short_url
BBC UK,Ofsted sorry for its role in Ruth Perry's suicide,https://www.bbc.co.uk/news/education-68024838?at_medium=RSS&at_campaign=KARANGA,https://da.gd/fxh3s
BBC UK,"Child sexual abuse victims waiting longer for help, report finds",https://www.bbc.co.uk/news/uk-68006113?at_medium=RSS&at_campaign=KARANGA,https://da.gd/iFDKI9
BBC UK,La Kena: Notorious Mexican cartel leader captured,https://www.bbc.co.uk/news/world-latin-america-68027129?at_medium=RSS&at_campaign=KARANGA,https://da.gd/DysA
BBC UK,MP's pet abduction bill set to be given government support,https://www.bbc.co.uk/news/uk-politics-68021178?at_medium=RSS&at_campaign=KARANGA,https://da.gd/0sdm7
BBC UK,Reluctant statesman Rishi Sunak turns focus to foreign affairs,https://www.bbc.co.uk/news/uk-politics-67884751?at_medium=RSS&at_campaign=KARANGA,https://da.gd/BjKRdz
