feed,title,long_url,short_url
NPR,Supreme Courts in 3 states will hear cases about abortion access this week,https://www.npr.org/2023/12/11/1218357869/state-supreme-courts-abortion-wyoming-new-mexico-arizona,https://da.gd/8jKb
NPR,Worried your kid might have appendicitis? Try the jump test,https://www.npr.org/sections/health-shots/2023/12/11/1218313191/worried-your-kid-might-have-appendicitis-try-the-jump-test,https://da.gd/bvOM
NPR,"With the Israel-Hamas war, Sunni and Shia armed groups find uncommon unity",https://www.npr.org/2023/12/11/1218145466/israel-hamas-war-shia-sunni-iran-backed-militants,https://da.gd/eGZU
NPR,Seeking redemption for aged and infirm prisoners amid Alabama's high bar for parole,https://www.npr.org/2023/12/11/1217710630/prison-parole-alabama-redemption-earned-prisoners-release,https://da.gd/rPcS8Z
NPR,"With an inconclusive counteroffensive, Ukraine looks toward an anxious winter",https://www.npr.org/2023/12/11/1216990973/russia-ukraine-war-counteroffensive-winter,https://da.gd/PyOv
NPR,Trump says he won't testify as planned in his civil fraud trial,https://www.npr.org/2023/12/11/1218470870/trump-testimony-new-york-fraud-trial,https://da.gd/2N98
