feed,title,long_url,short_url
BBC UK,"Arrests, accusations and AI: India’s election unpacked",https://www.bbc.com/news/videos/cqqq2g653gro,https://da.gd/yaFYIk
BBC UK,The artist 'not surprised' to be a best-seller,https://www.bbc.com/news/articles/c5115079p53o,https://da.gd/2Jkyl1
BBC UK,Young French leader's rise and Belgium's future existence: What to watch in EU elections,https://www.bbc.com/news/articles/c0wwepv5l6xo,https://da.gd/dx4uE
BBC UK,Your pictures on the theme of 'ripples',https://www.bbc.com/news/articles/c4nn25pleego,https://da.gd/0IXjZ
BBC UK,The American D-Day soldiers who left messages in a castle,https://www.bbc.com/news/articles/cyjj8xnlvz2o,https://da.gd/FPnGn
BBC UK,Minjee Lee joins three-way lead at US Women's Open,https://www.bbc.com/sport/golf/articles/cv22wnz0wq9o,https://da.gd/pwoR9
