feed,title,long_url,short_url
NPR,"In Morocco's Atlas Mountains, survivors of the quake take stock of all they've lost",https://www.npr.org/2023/09/20/1199471923/morocco-earthquake-atlas-mountains-survivors-loss,https://da.gd/XrSR9
NPR,A federal agency wants to give safety tips to young adults. So it's dropping an album,https://www.npr.org/2023/09/20/1199192682/consumer-product-safety-commission-music-album,https://da.gd/WmNcFy
NPR,"At new mental health courts in California, judges will be able to mandate treatment",https://www.npr.org/sections/health-shots/2023/09/20/1200479082/mental-health-courts-california-care-debate,https://da.gd/DvGfd
NPR,GOP presidential hopeful Doug Burgum says he'd leave abortion laws up to the states,https://www.npr.org/2023/09/20/1200378409/doug-burgum-president-candidate-2024,https://da.gd/Zprla3
NPR,"AG Garland in the hot seat as House Judiciary to probe him on Hunter Biden, Trump",https://www.npr.org/2023/09/20/1200430655/merrick-garland-congress-hearing,https://da.gd/tak8Yg
NPR,"Tired of the Republican primary, GOP frontrunner Donald Trump shifts focus to Biden",https://www.npr.org/2023/09/20/1200351416/donald-trump-joe-biden-general-election-2024-gop-primary,https://da.gd/5Sq7w
NPR,Fed-up consumers are increasingly going after food companies for misleading claims,https://www.npr.org/2023/09/20/1200417169/food-company-starbucks-misleading-claims-lawsuits,https://da.gd/SaKvT3
NPR,"A NASA astronaut approaches a year in space, the longest time for any American",https://www.npr.org/2023/09/20/1200374445/nasa-frank-rubio-record-yearlong-flight,https://da.gd/HC6nbx
NPR,Why the UAW is fighting so hard for these 4 key demands in the auto strike,https://www.npr.org/2023/09/20/1200357955/uaw-big-3-strike-auto-shawn-fain,https://da.gd/LAYyX
