feed,title,long_url,short_url
BBC UK,Adam Johnson: Police say ice hockey death inquiry will take time,https://www.bbc.co.uk/news/uk-england-nottinghamshire-67272229?at_medium=RSS&at_campaign=KARANGA,https://da.gd/Kdxwv
BBC UK,'Lost demon' uncovered in Joshua Reynolds painting,https://www.bbc.co.uk/news/entertainment-arts-67271251?at_medium=RSS&at_campaign=KARANGA,https://da.gd/FSexNI
BBC UK,Carlsberg cuts ties with 'stolen' Russian business,https://www.bbc.co.uk/news/articles/cgxkx9g2kn4o?at_medium=RSS&at_campaign=KARANGA,https://da.gd/w0pK0
BBC UK,"Leeds hospital bomb accused driven by anger at colleagues, jury told",https://www.bbc.co.uk/news/uk-england-leeds-67275319?at_medium=RSS&at_campaign=KARANGA,https://da.gd/CHwE1h
BBC UK,ICC Cricket World Cup highlights: Pakistan easily beat Bangladesh by seven wickets,https://www.bbc.co.uk/sport/av/cricket/67271755?at_medium=RSS&at_campaign=KARANGA,https://da.gd/uyfpfM
BBC UK,Jabalia refugee camp blast: Dozens reportedly killed in Gaza,https://www.bbc.co.uk/news/world-middle-east-67276822?at_medium=RSS&at_campaign=KARANGA,https://da.gd/5e5hpq
