feed,title,long_url,short_url
BBC UK,Landmark ruling could threaten future UK oil drilling,https://www.bbc.com/news/articles/cxwwzmn12g9o,https://da.gd/pjeeF
BBC UK,Cargo from 'most ancient' shipwreck found off Israel,https://www.bbc.com/news/articles/cedd0l1wk8qo,https://da.gd/PIkI
BBC UK,Royal Mail launches Red Arrows anniversary stamps,https://www.bbc.com/news/articles/c1001692e77o,https://da.gd/Z8pU0B
BBC UK,Kendrick Lamar performs Drake diss track five times,https://www.bbc.com/news/articles/c0dd3vyw4myo,https://da.gd/S9WBJ
BBC UK,Cooper appointed Leicester manager,https://www.bbc.com/sport/football/articles/ckvvwxj881yo,https://da.gd/SeryG
