feed,title,long_url,short_url
BBC UK,US secretly sends long-range missiles to Ukraine,https://www.bbc.co.uk/news/world-europe-68893196,https://da.gd/Y05J
BBC UK,"One-word Ofsted grades should stay, says government",https://www.bbc.com/news/articles/c2lezd59e9lo,https://da.gd/jx9QX
BBC UK,Labour 'vow to nationalise rail' and school stabbing,https://www.bbc.co.uk/news/blogs-the-papers-68894168,https://da.gd/8RPhp
BBC UK,Watch: Match of the Day,https://www.bbc.co.uk/iplayer/episode/m001ym3x,https://da.gd/HpJS
BBC UK,Van Dijk questions desire of team-mates after loss,https://www.bbc.com/sport/football/articles/c19dzjkyn3po,https://da.gd/TzADM8
