feed,title,long_url,short_url
Al Jazeera,How much is each NATO country spending on its military in 2024?,https://www.aljazeera.com/news/2024/7/11/how-much-does-each-nato-country-spend-in-2024?traffic_source=rss,https://da.gd/qhCTpd
Al Jazeera,Columbia University protester says Gaza campaign won’t stop,https://www.aljazeera.com/program/newsfeed/2024/7/11/columbia-university-protester-says-gaza-campaign-wont-stop?traffic_source=rss,https://da.gd/t4ymmq
Al Jazeera,Ten years on: Who is responsible for the downing of Flight MH17?,https://www.aljazeera.com/program/101-east/2024/7/11/ten-years-on-who-is-responsible-for-the-downing-of-flight-mh17?traffic_source=rss,https://da.gd/AijRX2
Al Jazeera,Video: Astronauts stuck on International Space Station give update,https://www.aljazeera.com/program/newsfeed/2024/7/11/video-astronauts-stuck-on-international-space-station-give-update?traffic_source=rss,https://da.gd/30rkz
Al Jazeera,Why are NATO and China facing off over Ukraine?,https://www.aljazeera.com/news/2024/7/11/why-are-nato-and-china-facing-off-over-ukraine?traffic_source=rss,https://da.gd/3vtHy
Al Jazeera,Russia court rejects appeal by jailed rights advocate Oleg Orlov,https://www.aljazeera.com/news/2024/7/11/russia-court-rejects-appeal-by-jailed-rights-advocate-oleg-orlov?traffic_source=rss,https://da.gd/6Jrsd
