feed,title,long_url,short_url
NPR,"New proteins, better batteries: Scientists are using AI to speed up discoveries",https://www.npr.org/sections/health-shots/2023/10/12/1205201928/artificial-intelligence-ai-scientific-discoveries-proteins-drugs-solar,https://da.gd/9i1wi1
NPR,Climate rules are coming for corporate America,https://www.npr.org/2023/10/12/1205068747/climate-change-emissions-companies-disclosure-sec-california,https://da.gd/cHvRNW
NPR,Scalise says he's a unifier. The current state of the GOP will test that skill,https://www.npr.org/2023/10/12/1205346289/scalise-says-hes-a-unifier-the-current-state-of-the-gop-will-test-that-skill,https://da.gd/04JYh
NPR,Take a peek at what NASA brought back from an asteroid,https://www.npr.org/2023/10/12/1205300000/take-a-peek-at-what-nasa-brought-back-from-an-asteroid,https://da.gd/Pluco
NPR,What is a kibbutz? The roots of Israel's communal villages where violence raged,https://www.npr.org/2023/10/12/1205284601/what-is-a-kibbutz-the-roots-of-israels-communal-villages-where-violence-raged,https://da.gd/vmqH
NPR,"A stranger swung in to help when she slipped on ice. Now, she wants to pay it forward",https://www.npr.org/2023/10/12/1205095934/a-stranger-swung-in-to-help-when-she-slipped-on-ice-now-she-wants-to-pay-it-forw,https://da.gd/J3UK2
