feed,title,long_url,short_url
BBC UK,Kent woman called 999 from hospital over care concerns,https://www.bbc.co.uk/news/uk-england-kent-66837434?at_medium=RSS&at_campaign=KARANGA,https://da.gd/b4r2k
BBC UK,Ronnie MacKinnon: Former Rangers and Scotland centre-half dies at 83,https://www.bbc.co.uk/sport/football/66838489?at_medium=RSS&at_campaign=KARANGA,https://da.gd/MVM3X
BBC UK,BMW PGA Championship: Ryan Fox recovers from a triple bogey to win at Wentworth - highlights,https://www.bbc.co.uk/sport/av/golf/66839422?at_medium=RSS&at_campaign=KARANGA,https://da.gd/rxFXt
New York Times World,Ukraine Says It Has Retaken Strategic Village Near Bakhmut,https://www.nytimes.com/2023/09/17/world/europe/ukraine-russia-war-klishchiivka-bakhmut.html,https://da.gd/bbOmQe
Al Jazeera,Fire engulfs Khartoum’s iconic Greater Nile Petroleum Operating Company,https://www.aljazeera.com/news/2023/9/17/fire-engulfs-khartoums-iconic-greater-nile-petroleum-operating-company?traffic_source=rss,https://da.gd/b8bPLV
Al Jazeera,Over 200 arrested in Germany after violence at Eritrean diaspora event,https://www.aljazeera.com/news/2023/9/17/over-200-arrested-in-germany-after-violence-at-eritrean-diaspora-event?traffic_source=rss,https://da.gd/DnIuuB
