feed,title,long_url,short_url
NPR,Archaeologists in Turkey have identified massive structures below a Roman-era castle,https://www.npr.org/2023/09/01/1191263572/turkey-archaeology-zerzevan-castle-discoveries,https://da.gd/PUF2v7
NPR,What has Biden started doing differently? Test yourself in this week's news quiz,https://www.npr.org/2023/09/01/1196990480/npr-news-quiz-biden-simone-biles-drugs-blue-moon-bees,https://da.gd/K76yF
NPR,"Age ain't nothing but a number but for aging lawmakers, it's raising questions",https://www.npr.org/2023/09/01/1197120521/washington-aging-politicians-old-congress-biden-trump-mcconnell-feinstein,https://da.gd/Y79wB
NPR,"In the Trump Georgia case, conflicting legal strategies complicate the path to trial",https://www.npr.org/2023/09/01/1197080384/georgia-trump-election-case-legal-complexities,https://da.gd/gq8cJ
NPR,"Understaffed nursing homes are a huge problem, and Biden's promised fix 'sabotaged'",https://www.npr.org/sections/health-shots/2023/09/01/1197074873/nursing-homes-staff-ratio-biden-medicare-medicaid,https://da.gd/uDRW1j
NPR,"Weeks after the fire, the response in Maui shifts from a sprint to a marathon",https://www.npr.org/2023/09/01/1196690966/weeks-after-the-fire-the-response-in-maui-shifts-from-a-sprint-to-a-marathon,https://da.gd/73dp1d
NPR,New York City is embracing teletherapy for teens. It may not be the best approach,https://www.npr.org/sections/health-shots/2023/09/01/1194818918/online-therapy-teens-high-school-nyc,https://da.gd/HGcFk
NPR,Canada issues travel advisory warning over U.S. states' LGBTQ+ laws,https://www.npr.org/2023/09/01/1197169683/canada-issues-travel-advisory-warning-over-u-s-states-lgbtq-laws,https://da.gd/JUmgI
