feed,title,long_url,short_url
BBC UK,Ukraine war: Putin influencers profiting from war propaganda,https://www.bbc.co.uk/news/world-europe-66653837?at_medium=RSS&at_campaign=KARANGA,https://da.gd/VuAXFK
BBC UK,Aditya-L1: India set to launch its first mission to Sun,https://www.bbc.co.uk/news/world-asia-india-66643805?at_medium=RSS&at_campaign=KARANGA,https://da.gd/DnTStu
BBC UK,Macron looks on as France's Africa policy crumbles,https://www.bbc.co.uk/news/world-europe-66668094?at_medium=RSS&at_campaign=KARANGA,https://da.gd/UZBX
BBC UK,UK scientists tackle periods in polar research,https://www.bbc.co.uk/news/science-environment-66659741?at_medium=RSS&at_campaign=KARANGA,https://da.gd/4wD3os
BBC UK,"Saturday's gossip: Salah, Greenwood, Hojbjerg, Adams, Daka, Gray",https://www.bbc.co.uk/sport/66686415?at_medium=RSS&at_campaign=KARANGA,https://da.gd/JyQ8L
