feed,title,long_url,short_url
BBC UK,Author Edna O'Brien dies at age of 93,https://www.bbc.com/news/articles/cglk4ek5j3zo,https://da.gd/PaQ7
BBC UK,Libyan officials jailed over deadly floods,https://www.bbc.com/news/articles/cg3ewxd7wezo,https://da.gd/AswptY
BBC UK,Fox cub freed after getting stuck in garden chair,https://www.bbc.com/news/articles/cz9xep7e0x3o,https://da.gd/UvagEM
BBC UK,Parisians’ Olympic spirit not dampened – but grumbles remain,https://www.bbc.com/news/articles/ckmg3lyd14do,https://da.gd/jsPk
BBC UK,Wrong national anthem played for South Sudan at Olympics,https://www.bbc.com/news/articles/cevwrj789l7o,https://da.gd/dvrG0
