feed,title,long_url,short_url
NPR,It's a pink Halloween. Here are some of the most popular costumes of 2023,https://www.npr.org/2023/10/18/1206356916/its-a-pink-halloween-here-are-some-of-the-most-popular-costumes-of-2023,https://da.gd/RB3brV
NPR,"Bike riding in middle school may boost mental health, study finds",https://www.npr.org/sections/health-shots/2023/10/18/1206583788/bike-riding-in-middle-school-may-boost-mental-health-study-finds,https://da.gd/mGx1GF
NPR,What Republican presidential candidates are saying about the Israel-Hamas war,https://www.npr.org/2023/10/18/1206565510/republican-president-election-israel-hamas-trump-haley-biden,https://da.gd/thUd
NPR,The governor tried banning guns in Albuquerque. The public health emergency continues,https://www.npr.org/2023/10/18/1206494502/the-governor-tried-banning-guns-in-albuquerque-the-public-health-emergency-conti,https://da.gd/L0h0jZ
NPR,The latest college campus freebies? Naloxone and fentanyl test strips,https://www.npr.org/2023/10/18/1206274353/college-fentanyl-overdose,https://da.gd/GgtQ
NPR,Autoworkers used to have lifelong health care and pension income. They want it back,https://www.npr.org/2023/10/18/1206105208/autoworkers-retirement-pensions-health-care-uaw-gm-motor-ford-stelllantis,https://da.gd/A4uY
