feed,title,long_url,short_url
BBC UK,"The Papers: EU rejects UK migrant plan, and PSNI breach fears",https://www.bbc.co.uk/news/blogs-the-papers-66505731?at_medium=RSS&at_campaign=KARANGA,https://da.gd/h8GXv
BBC UK,Disney's Snow White: Has the fairy tale already gone sour?,https://www.bbc.co.uk/news/entertainment-arts-66496850?at_medium=RSS&at_campaign=KARANGA,https://da.gd/dPBqL
BBC UK,Burning mangrove trees for a living: 'I'd quit tomorrow if I could',https://www.bbc.co.uk/news/world-asia-66393515?at_medium=RSS&at_campaign=KARANGA,https://da.gd/tlgI
BBC UK,Ukraine therapist: I've got no weapon but knowledge,https://www.bbc.co.uk/news/world-europe-66008783?at_medium=RSS&at_campaign=KARANGA,https://da.gd/sQBynP
BBC UK,Why fashion brands are putting celebrities in charge,https://www.bbc.co.uk/news/business-66481021?at_medium=RSS&at_campaign=KARANGA,https://da.gd/NSgF
