feed,title,long_url,short_url
BBC UK,Alaska Air crew detail 'chaos' after mid-air blowout,https://www.bbc.com/news/articles/cg4yqq72dyeo,https://da.gd/j75x
BBC UK,"Man charged over theft of Bluey coins worth $400,000",https://www.bbc.com/news/articles/c5y3848691go,https://da.gd/9nocdZ
BBC UK,AI in healthcare: what are the risks for for the NHS?,https://www.bbc.com/news/articles/c6233x9k4dlo,https://da.gd/aUZfob
BBC UK,Pregnant woman's shock at four-week scan delay,https://www.bbc.com/news/articles/cpdll8w9l2go,https://da.gd/xX8vd
BBC UK,'I was force-fed crack by criminals who took over my house',https://www.bbc.com/news/articles/c978z09ez1ro,https://da.gd/1O29
BBC UK,Wildcat kitten caught on thermal imaging camera,https://www.bbc.com/news/videos/cg4yy9kqe7ro,https://da.gd/649XPJ
BBC UK,"Scammers target Jay Slater's funeral, charity says",https://www.bbc.com/news/articles/cm2nnrg25deo,https://da.gd/4DS9sd
