feed,title,long_url,short_url
BBC UK,'Sombre' inquest opens for girls killed in Southport attack,https://www.bbc.com/news/articles/cx2gk9kyngno,https://da.gd/elJke
BBC UK,Thai court dissolves reformist party that won election,https://www.bbc.com/news/articles/crkmdd4vevxo,https://da.gd/Gq1yfq
BBC UK,Star Wars actress Daisy Ridley reveals Graves' disease diagnosis,https://www.bbc.com/news/articles/cy0rl8kpvz2o,https://da.gd/5s0L
BBC UK,Government concerned by immigration lawyer 'hitlist',https://www.bbc.com/news/articles/c624r77gnm2o,https://da.gd/QnSQh
BBC UK,The Nobel winner tasked with leading a nation out of chaos,https://www.bbc.com/news/articles/cz73jwy8nnwo,https://da.gd/mdrIcT
BBC UK,At least two people killed in German hotel collapse,https://www.bbc.com/news/articles/cj4xd89yev0o,https://da.gd/i5Kbm
