feed,title,long_url,short_url
NPR,Cardboard beds have returned to the Olympics. What do they do?,https://www.npr.org/2024/07/25/nx-s1-5050830/cardboard-beds-returned-olympics-what-do-they-do,https://da.gd/J00PA
NPR,Rogue ACA insurance agents could face criminal charges under a proposed law,https://www.npr.org/sections/shots-health-news/2024/07/25/nx-s1-5050937/aca-obamacare-health-insurance-rogue-agents-wyden-bill,https://da.gd/yVvx7a
NPR,Will Harris sway PA voters? A Pittsburgh area Democrat and Republican each have a say,https://www.npr.org/2024/07/25/nx-s1-5049800/pittsburgh-voters-react-harris-democratic-presidential-candidate,https://da.gd/2xeTWh
NPR,California's newest state park is like a time machine,https://www.npr.org/2024/07/25/nx-s1-5049899/california-state-park-dos-rios-flooding-climate-change,https://da.gd/fh9fGM
NPR,4 takeaways from President Biden’s Oval Office address,https://www.npr.org/2024/07/25/g-s1-12556/biden-presidency-oval-office-legacy-history-trump-harris-democracy,https://da.gd/y0jj7
NPR,"U.S. women's soccer coach says the team has 'moved past' losses, is ready for Paris",https://www.npr.org/2024/07/25/g-s1-12679/uswnt-paris-olympics-zambia-soccer,https://da.gd/1ktkB
