feed,title,long_url,short_url
BBC UK,Chris Mason: Big moment on small boats but solution far off,https://www.bbc.co.uk/news/uk-politics-66232322?at_medium=RSS&at_campaign=KARANGA,https://da.gd/XK6KoO
BBC UK,Carla Foster: Mother jailed over lockdown abortion to be released,https://www.bbc.co.uk/news/uk-england-65581850?at_medium=RSS&at_campaign=KARANGA,https://da.gd/kP3gU
BBC UK,Banks warned over 'weak excuses' for savings rates,https://www.bbc.co.uk/news/business-66232442?at_medium=RSS&at_campaign=KARANGA,https://da.gd/sk5K4
BBC UK,Commonwealth Games: Australia drop out could be 'death knell',https://www.bbc.co.uk/news/world-australia-66229577?at_medium=RSS&at_campaign=KARANGA,https://da.gd/lYXmW
BBC UK,Amazon customer sent Weetabix instead of £500 laptop,https://www.bbc.co.uk/news/uk-england-manchester-66179830?at_medium=RSS&at_campaign=KARANGA,https://da.gd/U8whb
BBC UK,The Open: Rory McIlroy says Scottish Open win 'perfect preparation' for Royal Liverpool,https://www.bbc.co.uk/sport/golf/66227692?at_medium=RSS&at_campaign=KARANGA,https://da.gd/qLUz3o
