feed,title,long_url,short_url
NPR,Students and civil rights groups blast police response to campus protests,https://www.npr.org/2024/05/08/1248935672/campus-protests-police-arrests,https://da.gd/Z2uJU
NPR,The FDA misses its own deadline to propose a ban on formaldehyde from hair products,https://www.npr.org/2024/05/08/1249365649/fda-misses-deadline-formaldehyde-ban,https://da.gd/CyAy6
NPR,"Bipartisan congressional spouses tackle cancer prevention, and leave politics out",https://www.npr.org/2024/05/08/1248795509/congress-spouses-cancer,https://da.gd/Pf0vi
NPR,"Migrant arrivals stretched Denver's budget. Now, the city is scaling back aid",https://www.npr.org/2024/05/08/1249823648/immigration-denver-migrants-spending,https://da.gd/Rb0yq
NPR,Migrants claiming asylum can be allowed into the U.S. Here's how it works,https://www.npr.org/2024/05/08/1249629647/immigration-border-asylum-parole-explained,https://da.gd/OqgP4
NPR,"Trump's speeches follow a familiar playlist, featuring greatest hits among new tunes",https://www.npr.org/2024/05/08/1249245334/donald-trump-rally-speech-biden-al-capone,https://da.gd/JtWGe
NPR,The U.S. military pier off Gaza may soon be operating. Aid workers question its role,https://www.npr.org/2024/05/08/1249343999/gaza-pier-biden-humanitarian-aid,https://da.gd/rZmj6
