feed,title,long_url,short_url
BBC UK,Surprise mobile mid-contract price rises banned,https://www.bbc.com/news/articles/c51ydz24lj2o,https://da.gd/6kfHT
BBC UK,Video shows drug's 'life-changing' effect on man with Parkinson's,https://www.bbc.com/news/articles/cd1xwr2qy3do,https://da.gd/rA2Vd
BBC UK,Government borrowing in June higher than expected,https://www.bbc.com/news/articles/cgxqzp2zdw4o,https://da.gd/F7X9u
BBC UK,Pupil films coach driver’s expletive-filled rant,https://www.bbc.com/news/articles/ced3z8kx9eqo,https://da.gd/ynvUv
BBC UK,UN top court to give opinion on Israeli occupation,https://www.bbc.com/news/articles/cjerjzxlpvdo,https://da.gd/zlpbKI
