feed,title,long_url,short_url
BBC UK,Chimps share humans' 'snappy' conversational style,https://www.bbc.com/news/articles/c25lw18zrjyo,https://da.gd/YFhznC
BBC UK,Keanu Reeves: I think about death all the time,https://www.bbc.com/news/articles/cl7y05lr475o,https://da.gd/oCxLE
BBC UK,Is this the end of branded school PE kits?,https://www.bbc.com/news/articles/c28e4p89lyno,https://da.gd/ySh8QB
BBC UK,"Damage, destruction and fear along the Israel-Lebanon border",https://www.bbc.com/news/articles/cv2gj544x65o,https://da.gd/5lblLG
BBC UK,"Batons, tear gas, live fire - Kenyans face police brutality",https://www.bbc.com/news/articles/cxe24eyvxn2o,https://da.gd/tEbNDi
