feed,title,long_url,short_url
NPR,His wife was dying. Here's how a nurse became a 'beacon of light',https://www.npr.org/2024/01/09/1223050752/cancer-health-nurse-hospital-care,https://da.gd/8UulD
NPR,Trump faces a make-or-break moment in the election interference case,https://www.npr.org/2024/01/09/1222887973/trump-immunity-from-prosecution,https://da.gd/uIX7r
NPR,Tourism ruined my city. Tourism is saving my city,https://www.npr.org/2024/01/09/1222810366/tourism-seville-airbnb-spain-accommodation-economy,https://da.gd/LnZ3O
NPR,The FAFSA rollout has been rough on students. The biggest problem is yet to come,https://www.npr.org/2024/01/09/1222664638/fafsa-student-financial-aid-college,https://da.gd/MK1s
NPR,Here are important dates on the 2024 election calendar,https://www.npr.org/2024/01/09/1219357967/2024-election-dates-primaries,https://da.gd/3VkPs
