feed,title,long_url,short_url
NPR,Extreme temperatures can cause all sorts of heat-related illnesses,https://www.npr.org/2024/06/21/nx-s1-5010414/extreme-temperatures-can-cause-all-sorts-of-heat-related-illnesses,https://da.gd/XLwNst
NPR,Is a statewide ban on cell phones in schools realistic?,https://www.npr.org/2024/06/21/nx-s1-5013628/is-a-statewide-ban-on-cell-phones-in-schools-realistic,https://da.gd/xQlCW1
NPR,Poll: France’s far-right party is on a path to win snap parliamentary elections,https://www.npr.org/2024/06/21/nx-s1-5011628/poll-frances-far-right-party-is-on-a-path-to-win-snap-parliamentary-elections,https://da.gd/ltPAf
NPR,Abortion is becoming more common in primary care clinics as doctors challenge stigma,https://www.npr.org/sections/shots-health-news/2024/06/21/nx-s1-4995771/abortion-primary-care-family-medicine,https://da.gd/MBdGRf
NPR,Asteroid headed toward Earth? NASA simulation explores how the nation might respond,https://www.npr.org/2024/06/21/nx-s1-5013508/asteroid-hit-earth-nasa-simulation-emergency-response,https://da.gd/JjnRp
NPR,D.C. woman returns thrifted vase — a priceless Mayan artifact — to its homeland,https://www.npr.org/2024/06/21/nx-s1-5013645/mayan-vase-thrift-store,https://da.gd/nJ7hK
NPR,Which celebrity's mugshot set the internet ablaze this week? Find out in the quiz,https://www.npr.org/2024/06/21/g-s1-5342/solstice-social-media-timberlake-tonys-hurricane-olympics-news-quiz,https://da.gd/nyiycg
