feed,title,long_url,short_url
BBC UK,The Papers: Warning over 'budget for the rich' and Farage in the mud,https://www.bbc.co.uk/news/blogs-the-papers-67465797?at_medium=RSS&at_campaign=KARANGA,https://da.gd/cQeA1S
BBC UK,Ukraine war: The Russians snitching on colleagues and strangers,https://www.bbc.co.uk/news/world-europe-67427422?at_medium=RSS&at_campaign=KARANGA,https://da.gd/lLO0My
BBC UK,Don Walsh: The man who made the deepest ever dive,https://www.bbc.co.uk/news/science-environment-67445718?at_medium=RSS&at_campaign=KARANGA,https://da.gd/ZZn8sH
BBC UK,Art and class: Working-class artists on breaking into exclusive world,https://www.bbc.co.uk/news/uk-wales-67055651?at_medium=RSS&at_campaign=KARANGA,https://da.gd/1VgCDk
BBC UK,What is income tax and how much will I pay?,https://www.bbc.co.uk/news/explainers-63635185?at_medium=RSS&at_campaign=KARANGA,https://da.gd/Sx2kv
BBC UK,Poland truck protests leave Ukrainian drivers stranded,https://www.bbc.co.uk/news/world-europe-67457457?at_medium=RSS&at_campaign=KARANGA,https://da.gd/5zR5Sv
