feed,title,long_url,short_url
BBC World,Mar-a-Lago IT manager implicates Trump in classified files case,https://www.bbc.co.uk/news/world-us-canada-66589807?at_medium=RSS&at_campaign=KARANGA,https://da.gd/9iytP
BBC World,"FTX founder Bankman-Fried living on bread and water, lawyer says",https://www.bbc.co.uk/news/business-66589797?at_medium=RSS&at_campaign=KARANGA,https://da.gd/L2VXy
BBC World,Four moments reveal how quickly US floodwater moved,https://www.bbc.co.uk/news/world-us-canada-66586047?at_medium=RSS&at_campaign=KARANGA,https://da.gd/YJegbF
BBC World,Caleb Farley: NFL player’s father killed in home explosion,https://www.bbc.co.uk/news/world-us-canada-66588923?at_medium=RSS&at_campaign=KARANGA,https://da.gd/VCYFxt
BBC World,French airport to be renamed after Queen Elizabeth II in tribute,https://www.bbc.co.uk/news/uk-66577824?at_medium=RSS&at_campaign=KARANGA,https://da.gd/P5JxiL
BBC World,Three reasons why Trump's arrest in Georgia may be different,https://www.bbc.co.uk/news/world-us-canada-66588924?at_medium=RSS&at_campaign=KARANGA,https://da.gd/G4yNC
