feed,title,long_url,short_url
NPR,Broken wings: Complaints about U.S. airlines soared again this year,https://www.npr.org/2023/12/14/1219147316/broken-wings-complaints-about-u-s-airlines-soared-again-this-year,https://da.gd/DbAEP
NPR,"Away from Gaza, homes in south Lebanon bear the scars of Israel's other front line",https://www.npr.org/2023/12/14/1218729551/lebanon-israel-border-hezbollah-conflict,https://da.gd/rJc2M
NPR,Ohio prosecutors broke rules to win convictions and got away with it,https://www.npr.org/2023/12/14/1216111092/ohio-court-prosecutor-misconduct-due-process-rights,https://da.gd/8GOXH
NPR,"Prisoners are suing Alabama over forced labor, calling it a 'form of slavery'",https://www.npr.org/2023/12/14/1219187249/prisoners-are-suing-alabama-over-forced-labor-calling-it-a-form-of-slavery,https://da.gd/ienKYe
NPR,Israel is using an AI system to find targets in Gaza. Experts say it's just the start,https://www.npr.org/2023/12/14/1218643254/israel-is-using-an-ai-system-to-find-targets-in-gaza-experts-say-its-just-the-st,https://da.gd/NPecK
