feed,title,long_url,short_url
BBC UK,Cash offer for new childcare workers amid shortage,https://www.bbc.co.uk/news/education-68128705?at_medium=RSS&at_campaign=KARANGA,https://da.gd/QSc1kI
BBC UK,Water bills to rise above inflation in April,https://www.bbc.co.uk/news/business-68172008?at_medium=RSS&at_campaign=KARANGA,https://da.gd/ReRp
BBC UK,Improvements in cancer survival rates slowing down,https://www.bbc.co.uk/news/health-68170218?at_medium=RSS&at_campaign=KARANGA,https://da.gd/qypHZu
BBC UK,AI will not be the destroyer of jobs - Bank chief,https://www.bbc.co.uk/news/technology-68170068?at_medium=RSS&at_campaign=KARANGA,https://da.gd/rDauL
BBC UK,Patient 'reborn' after Royal Papworth Hospital lung transplant,https://www.bbc.co.uk/news/uk-england-cambridgeshire-68166422?at_medium=RSS&at_campaign=KARANGA,https://da.gd/vCLhtQ
