feed,title,long_url,short_url
BBC UK,Pair given life sentences for 'brutal and planned' murder,https://www.bbc.co.uk/news/uk-england-manchester-68184224?at_medium=RSS&at_campaign=KARANGA,https://da.gd/DZd4L
BBC UK,Alkali attack suspect Abdul-Shokoor Ezedi was not eligible for asylum,https://www.bbc.co.uk/news/uk-68181899?at_medium=RSS&at_campaign=KARANGA,https://da.gd/Z7WxN
BBC UK,"Afcon 2023: Brilliant Premier League goals by African legends including Mohamed Salah, Sadio Mane & Yaya Toure",https://www.bbc.co.uk/sport/av/football/68012742?at_medium=RSS&at_campaign=KARANGA,https://da.gd/cksM8j
BBC UK,Arsenal v Liverpool: Is Sunday's Premier League game 'must-win' for Gunners?,https://www.bbc.co.uk/sport/football/68172904?at_medium=RSS&at_campaign=KARANGA,https://da.gd/0MZB6
BBC UK,Manchester United: Erik ten Hag to get 'creative' after failing to sign striker,https://www.bbc.co.uk/sport/football/68182143?at_medium=RSS&at_campaign=KARANGA,https://da.gd/z0H5R
