feed,title,long_url,short_url
BBC UK,They were Israel's eyes on the border - but their Hamas warnings went unheard,https://www.bbc.co.uk/news/world-middle-east-67958260?at_medium=RSS&at_campaign=KARANGA,https://da.gd/14noM
BBC UK,Emmy Awards: Succession and Wednesday stars gear up for ceremony delayed by strike,https://www.bbc.co.uk/news/entertainment-arts-67895725?at_medium=RSS&at_campaign=KARANGA,https://da.gd/5Dfy
BBC UK,Pothole reports hit a five-year high - but can new tech end them for good?,https://www.bbc.co.uk/news/science-environment-67957584?at_medium=RSS&at_campaign=KARANGA,https://da.gd/hejtrk
BBC UK,The Papers: 'Stop the deaths' and Post Office plea for justice,https://www.bbc.co.uk/news/blogs-the-papers-67977581?at_medium=RSS&at_campaign=KARANGA,https://da.gd/qD8AT
BBC UK,First Prince of Persia game in 14 years voiced in Farsi,https://www.bbc.co.uk/news/technology-67946084?at_medium=RSS&at_campaign=KARANGA,https://da.gd/KiVzR
