feed,title,long_url,short_url
NPR,Golfers travel from around the world for 3rd U.S. Adaptive Golf Open,https://www.npr.org/2024/07/09/nx-s1-5033218/golfers-travel-from-around-the-world-for-3rd-u-s-adaptive-golf-open,https://da.gd/N8g1lE
NPR,Mate's moment at the Copa,https://www.npr.org/2024/07/09/nx-s1-5034165/mates-moment-at-the-copa,https://da.gd/DWy9R
NPR,Federal judge resigns after investigation uncovers abusive conduct,https://www.npr.org/2024/07/09/nx-s1-5033838/federal-judge-resigns-after-investigation-uncovers-abusive-conduct,https://da.gd/QDxO9
NPR,Israel is divided over next steps in Gaza,https://www.npr.org/2024/07/09/nx-s1-5032996/israel-is-divided-over-next-steps-in-gaza,https://da.gd/bIO3E9
NPR,"Fed Chair tells Congress lowering interest rates poses ""two-sided risks""",https://www.npr.org/2024/07/09/nx-s1-5033147/fed-chair-tells-congress-lowering-interest-rates-poses-two-sided-risks,https://da.gd/m7oJxn
NPR,What can the White House do to control the narrative around Biden's ability?,https://www.npr.org/2024/07/09/nx-s1-5033190/what-can-the-white-house-do-to-control-the-narrative-around-bidens-ability,https://da.gd/5Y4FE
NPR,"After a string of upsets, Wimbledon heads into quarterfinals",https://www.npr.org/2024/07/09/nx-s1-5032864/after-a-string-of-upsets-wimbledon-heads-into-quarterfinals,https://da.gd/Vo6OD8
NPR,The physics of launching into space -- and crashing back down,https://www.npr.org/2024/07/09/nx-s1-4986334/the-physics-of-launching-into-space-and-crashing-back-down,https://da.gd/HJtOcc
NPR,Maduro faces uphill election battle after leading Venezuela into crisis,https://www.npr.org/2024/07/09/nx-s1-5028195/maduro-faces-uphill-election-battle-after-leading-venezuela-into-crisis,https://da.gd/3NGqNj
