feed,title,long_url,short_url
BBC UK,Two British brothers banned from Switzerland for museum heist,https://www.bbc.co.uk/news/world-europe-67988454?at_medium=RSS&at_campaign=KARANGA,https://da.gd/8ZaE0k
BBC UK,Palestinian envoy Husam Zomlot says UK guilty of hypocrisy,https://www.bbc.co.uk/news/uk-67999094?at_medium=RSS&at_campaign=KARANGA,https://da.gd/hdghkm
BBC UK,Boeing seeks Ryanair support with checks after mid-air blowout,https://www.bbc.co.uk/news/business-67994140?at_medium=RSS&at_campaign=KARANGA,https://da.gd/4Ef4a
BBC UK,Avanti sorry after leaked presentation cheers 'free money',https://www.bbc.co.uk/news/business-67997916?at_medium=RSS&at_campaign=KARANGA,https://da.gd/xopz
BBC UK,Isabel dos Santos: Angolan billionaire rejects fresh criminal charges,https://www.bbc.co.uk/news/world-africa-67998451?at_medium=RSS&at_campaign=KARANGA,https://da.gd/TgXp
