feed,title,long_url,short_url
BBC UK,Palestinian PM resigns over new Gaza 'reality',https://www.bbc.co.uk/news/world-middle-east-68406546,https://da.gd/ryfolQ
BBC UK,Wait for answers after mum dies in Spanish hospital,https://www.bbc.co.uk/news/uk-england-merseyside-68404378,https://da.gd/gweXD
BBC UK,Boeing review finds 'disconnect' on safety,https://www.bbc.co.uk/news/business-68409029,https://da.gd/VcU5st
BBC UK,US couple on hijacked boat feared killed,https://www.bbc.co.uk/news/world-us-canada-68407454,https://da.gd/GwwDt1
BBC UK,Top US court reviews social media free speech case,https://www.bbc.co.uk/news/world-us-canada-68407977,https://da.gd/PDDHAn
