feed,title,long_url,short_url
BBC UK,England fans' weird and wonderful road to Euro 2024 final,https://www.bbc.com/news/articles/ckmg5l3y5v8o,https://da.gd/VH5NQ
BBC UK,England v Spain: Familiar faces fighting for Euro 2024 glory,https://www.bbc.com/news/articles/cg3jy2je6j8o,https://da.gd/R7MYY
BBC UK,Meet the tycoons behind the grand Indian wedding,https://www.bbc.com/news/articles/c51yp353g0ro,https://da.gd/E5dzM
BBC UK,"Drums, fire and ice: Photos of the week",https://www.bbc.com/news/articles/ckrg3ym1n7ko,https://da.gd/fcWce
BBC UK,We're the Wimbledon ball girls who took on the pros,https://www.bbc.com/news/articles/cg64re46vk1o,https://da.gd/BPUc
