feed,title,long_url,short_url
NPR,International Holocaust Remembrance Day rings differently this year,https://www.npr.org/2024/01/27/1227156540/international-holocaust-remembrance-day-rings-differently-this-year,https://da.gd/5sEV6
NPR,An ancient Egyptian temple in New York inspires a Lebanese American musician,https://www.npr.org/2024/01/27/1226836657/h-sinno-mashrou-leila-temple-of-dendur,https://da.gd/MZ8YGv
NPR,A California community sees a dip in immigration. Where have all the people gone?,https://www.npr.org/2024/01/27/1226570548/border-migrants-mexico-jacumba-california-desert-immigration,https://da.gd/DXn77
NPR,Hollywood has been giving out climate change-focused awards for 33 years. Who knew?,https://www.npr.org/2024/01/27/1227246066/environmental-media-association-awards,https://da.gd/cLZ7DX
NPR,"They watched 2 election workers face abuse, and it's compelling them to serve in 2024",https://www.npr.org/2024/01/27/1227116952/fulton-county-ga-2024-election-workers,https://da.gd/lhCdQq
NPR,Nepal wants its men back from Russia's war in Ukraine after deaths on the front,https://www.npr.org/2024/01/27/1226170192/russia-ukraine-war-nepal-soldiers-killed,https://da.gd/fyp8o9
