feed,title,long_url,short_url
NPR,Supreme Court hears challenge to Trump-era ban on bump stocks for guns,https://npr.org/2024/02/28/1234248032/supreme-court-bump-stocks,https://da.gd/dULpr
NPR,"In Arizona, abortion politics are already playing out on the Senate campaign trail",https://npr.org/2024/02/28/1234317265/kari-lake-arizona-abortion-ballot-measure-ruben-gallego-kyrtsen-sinema,https://da.gd/mn3Is
NPR,A tech billionaire is quietly buying up land in Hawaii. No one knows why,https://npr.org/2024/02/28/1232564250/billionaire-benioff-buys-hawaii-land-salesforce,https://da.gd/03kbGl
NPR,The Palestinian Authority is promising change. Many Palestinians say it's not enough,https://npr.org/2024/02/28/1234242951/palestinian-authority-resignation-gaza-west-bank,https://da.gd/H5g0WO
NPR,Why Taiwanese Americans are moving to Taiwan — reversing the path of their parents,https://npr.org/2024/02/28/1233161947/taiwan-united-states-migration-migrants,https://da.gd/GtPpz1
