feed,title,long_url,short_url
Al Jazeera,‘Bold and beloved’: Palestinians mourn teenager killed by Israel,https://www.aljazeera.com/news/2023/9/15/bold-and-beloved-palestinians-mourn-teenager-killed-by-israel?traffic_source=rss,https://da.gd/vQ8v
Al Jazeera,‘Desert turned into a sea’: Eastern Libya flood survivors recount horror,https://www.aljazeera.com/news/2023/9/15/desert-turned-into-a-sea-eastern-libya-flood-survivors-recount-horror?traffic_source=rss,https://da.gd/Mzo6Y
Al Jazeera,"Biden to highlight US commitment to UN next week in New York, envoy says",https://www.aljazeera.com/news/2023/9/15/biden-to-highlight-us-commitment-to-un-next-week-in-new-york-envoy-says?traffic_source=rss,https://da.gd/BQcud
BBC UK,Gabby and Kenny Logan receive damages over false tax avoidance claims,https://www.bbc.co.uk/news/entertainment-arts-66817221?at_medium=RSS&at_campaign=KARANGA,https://da.gd/k1Ml
Al Jazeera,Macron says French ambassador ‘literally being held hostage’ in Niger,https://www.aljazeera.com/news/2023/9/15/macron-says-french-ambassador-to-niger-literally-held-hostage-by-junta?traffic_source=rss,https://da.gd/zJjIa
