feed,title,long_url,short_url
BBC World,Ashton Kutcher resigns from anti-child abuse charity over support for rapist Danny Masterson,https://www.bbc.co.uk/news/world-us-canada-66827692?at_medium=RSS&at_campaign=KARANGA,https://da.gd/1sOTL
BBC World,Moment police officer dragged away by escaping car,https://www.bbc.co.uk/news/world-us-canada-66827928?at_medium=RSS&at_campaign=KARANGA,https://da.gd/hTad2S
New York Times World,Previewing a Spring of Culture in Australia,https://www.nytimes.com/2023/09/15/world/australia/spring-culture-australia.html,https://da.gd/JyfXA2
BBC UK,Ashton Kutcher resigns from anti-child abuse charity over support for rapist Danny Masterson,https://www.bbc.co.uk/news/world-us-canada-66827692?at_medium=RSS&at_campaign=KARANGA,https://da.gd/1sOTL
NPR,Prosecutors in DC election case are seeking a partial gag order for Trump,https://www.npr.org/2023/09/15/1199932826/trump-election-case-gag-order-jack-smith,https://da.gd/f7Ityl
