feed,title,long_url,short_url
NPR,Basketball is booming in Rwanda — and the NBA there for the ride,https://www.npr.org/2024/05/28/1248274168/basketball-rwanda-nba-bal-africa,https://da.gd/U7Em
NPR,Have you lost someone to extreme weather? We want to hear from you,https://www.npr.org/2024/05/28/1252755995/npr-call-out-extreme-weather-disaster-climate-change,https://da.gd/ospicd
NPR,When driving on the wrong side of the road is the right way to speed up traffic,https://www.npr.org/2024/05/28/1243933142/diverging-diamond-interchange-chlewicki,https://da.gd/qwDQM
NPR,Her father was killed in a climate-driven flood. Here's how she's remembering him,https://www.npr.org/2024/05/28/1231126567/climate-change-flood-fatality-weather-disaster,https://da.gd/adCKzB
NPR,Alleged sexual misconduct by lawyers isn't uncommon. But facing punishment is tricky,https://www.npr.org/2024/05/23/1249675528/alleged-sexual-misconduct-lawyers,https://da.gd/b6eWyi
