feed,title,long_url,short_url
NPR,How an Indianapolis teacher is using the solar eclipse to inspire her students,https://npr.org/2024/03/25/1239947338/solar-eclipse-schools-teachers-students,https://da.gd/ctOMsb
NPR,"On eclipse day, hundreds of students will send up balloons for science",https://npr.org/2024/03/25/1240017029/solar-eclipse-nasa-students-research-balloons-science,https://da.gd/K2IaxC
NPR,"A mom's $97,000 question: How was an air-ambulance ride not medically necessary?",https://npr.org/sections/health-shots/2024/03/25/1239206451/a-moms-97-000-question-how-was-an-air-ambulance-ride-not-medically-necessary,https://da.gd/H2Ps1p
NPR,What one horticulturist has to say about pesticide residue on produce,https://npr.org/2024/03/25/1240564945/pesticide-residue-organic-produce,https://da.gd/DFue3Q
NPR,Kevin Hart takes home his Mark Twain Prize for American humor,https://npr.org/2024/03/25/1239665940/kevin-hart-mark-twain-prize,https://da.gd/AgOp1
NPR,"'This is garbage': Step aside, influencers — we're now in the era of de-influencing",https://npr.org/2024/03/25/1239897929/influencers-deinfluencing-tiktok-instagram-shopping-environment,https://da.gd/xjUVH
NPR,"Trump faces a crucial day in his hush-money trial, and a deadline to post bond",https://npr.org/2024/03/25/1240619833/trump-hush-money-trial-bond-payment,https://da.gd/CSC1
NPR,Chick-fil-A will begin using some antibiotics in its chicken again,https://npr.org/2024/03/25/1240639944/chick-fil-a-antibiotics,https://da.gd/Z0vt3
